{
  "$schema": "https://json-schema.org/draft/2020-12/schema",
  "$id": "https://nexuz.local/schemas/flow_schema.json",
  "title": "Nexuz FlowModel",
  "type": "object",
  "required": ["flow_id", "name", "nodes", "entry"],
  "properties": {
    "flow_id": { "type": "string" },
    "name": { "type": "string" },
    "version": { "type": "integer", "minimum": 1 },
    "execution_policy": {
      "type": ["object", "string"],
      "properties": {
        "mode": {
          "type": "string",
          "enum": ["safe", "standard", "legacy", "unrestricted"]
        },
        "allowlist": {
          "type": "array",
          "items": { "type": "string" },
          "uniqueItems": true
        },
        "denylist": {
          "type": "array",
          "items": { "type": "string" },
          "uniqueItems": true
        }
      },
      "additionalProperties": false
    },
    "variables": {
      "type": "object",
      "additionalProperties": true
    },
    "variable_schemas": {
      "type": "object",
      "additionalProperties": {
        "type": "object",
        "properties": {
          "type": {
            "type": "string",
            "enum": ["string", "number", "boolean", "object", "array", "object_array"]
          },
          "fields": {
            "type": "object",
            "additionalProperties": {
              "type": "string",
              "enum": ["string", "number", "boolean"]
            }
          },
          "itemType": {
            "type": "string",
            "enum": ["string", "number", "boolean"]
          }
        },
        "required": ["type"],
        "additionalProperties": true
      }
    },
    "entry": {
      "type": ["string", "null"]
    },
    "nodes": {
      "type": "object",
      "additionalProperties": {
        "type": "object",
        "required": ["type"],
        "properties": {
          "type": { "type": "string" },
          "params": { "type": "object" },
          "next": { "type": ["string", "null"] },
          "then": { "type": ["string", "null"] },
          "else": { "type": ["string", "null"] },
          "body": { "type": ["string", "null"] },
          "catch": { "type": ["string", "null"] },
          "finally": { "type": ["string", "null"] },
          "position": {
            "type": "object",
            "properties": {
              "x": { "type": "number" },
              "y": { "type": "number" }
            }
          }
        },
        "additionalProperties": true
      }
    }
  },
  "additionalProperties": true
}
